{
  "schema": "siren-report@1",
  "name": "unverified.upgrade-siren-demo.eth",
  "chainId": 11155111,
  "proxy": "0x8391fa804d3755493e3C9D362D49c339C4469388",
  "previousImplementation": "0xC53d3879aCF9Dd9d6fCF8Ed9B335A410Cc66Eb30",
  "currentImplementation": "0x819326b9d318e1bb8c3EA73e744dEEC0c9aAbe77",
  "verdict": "SIREN",
  "summary": "Implementation is not verified on Sourcify. No source -> no upgrade. Verdict: SIREN.",
  "findings": [
    {
      "id": "VERIFICATION_NOT_FOUND",
      "severity": "critical",
      "title": "Implementation not verified on Sourcify",
      "evidence": {
        "address": "0x819326b9d318e1bb8c3EA73e744dEEC0c9aAbe77",
        "sourcify": "https://sourcify.dev/server/check-by-addresses?addresses=0x819326b9d318e1bb8c3EA73e744dEEC0c9aAbe77&chainIds=11155111",
        "note": "Sourcify returned not_found; no source means no upgrade."
      }
    }
  ],
  "sourcify": {
    "previousVerified": true,
    "currentVerified": false,
    "links": []
  },
  "mode": "signed-manifest",
  "confidence": "operator-signed",
  "ens": {
    "recordsResolvedLive": true,
    "manifestHash": "0x0000000000000000000000000000000000000000000000000000000000000000",
    "owner": "0x747E453F13B5B14313E25393Eb443fbAaA250cfC"
  },
  "auth": {
    "status": "valid",
    "signatureType": "EIP-712",
    "signer": "0x747E453F13B5B14313E25393Eb443fbAaA250cfC",
    "signature": "0x209707e82c643304854f3b13d01c678e8bf24bba7c6ee90ca8f7cdccbebe78ef262fec27544b754f4a400d12d9dfcdd8451a6c3fcc2d45d91b58e16974e6dd721c",
    "signedAt": "2026-05-09T13:22:51.953Z"
  },
  "recommendedAction": "reject",
  "mock": false,
  "generatedAt": "2026-05-09T13:22:51Z"
}
