{
  "schema": "siren-report@1",
  "name": "safe.upgrade-siren-demo.eth",
  "chainId": 11155111,
  "proxy": "0x8391fa804d3755493e3C9D362D49c339C4469388",
  "previousImplementation": "0xC53d3879aCF9Dd9d6fCF8Ed9B335A410Cc66Eb30",
  "currentImplementation": "0x9A9DCb4CE0F03aCB6aa8e26905D6aBb93c95B774",
  "verdict": "SAFE",
  "summary": "Verified V2 upgrade with storage layout matching V1 slot-for-slot. No new privileged selectors.",
  "findings": [
    {
      "id": "VERIFICATION_CURRENT",
      "severity": "info",
      "title": "Current implementation verified on Sourcify",
      "evidence": {
        "address": "0x9A9DCb4CE0F03aCB6aa8e26905D6aBb93c95B774",
        "sourcify": "https://sourcify.dev/#/lookup/0x9A9DCb4CE0F03aCB6aa8e26905D6aBb93c95B774"
      }
    },
    {
      "id": "STORAGE_LAYOUT_COMPAT",
      "severity": "info",
      "title": "Storage layout slots 0 and 1 unchanged from V1",
      "evidence": {
        "previous": "0xC53d3879aCF9Dd9d6fCF8Ed9B335A410Cc66Eb30",
        "current": "0x9A9DCb4CE0F03aCB6aa8e26905D6aBb93c95B774"
      }
    }
  ],
  "sourcify": {
    "previousVerified": true,
    "currentVerified": true,
    "links": []
  },
  "mode": "signed-manifest",
  "confidence": "operator-signed",
  "ens": {
    "recordsResolvedLive": true,
    "manifestHash": "0x0000000000000000000000000000000000000000000000000000000000000000",
    "owner": "0x747E453F13B5B14313E25393Eb443fbAaA250cfC"
  },
  "auth": {
    "status": "valid",
    "signatureType": "EIP-712",
    "signer": "0x747E453F13B5B14313E25393Eb443fbAaA250cfC",
    "signature": "0x33486f96153c7caa2f6f69f965debb71ef3927166ebc25088466117890a3a13218a6ad65dc043e38899e3b4b3eac454d7e9c55a6e2614da69e0b04f2ec6e9a401b",
    "signedAt": "2026-05-09T13:22:51.945Z"
  },
  "recommendedAction": "approve",
  "mock": false,
  "generatedAt": "2026-05-09T13:22:51Z"
}
